{
  "$schema": "https://json-schema.org/draft/2020-12/schema",
  "$id": "https://ruby.local/schemas/roundcube-cve-original-pair-v1.json",
  "title": "RUBY Roundcube original CVE pair",
  "type": "object",
  "additionalProperties": false,
  "required": [
    "contract_version",
    "pair_id",
    "source_type",
    "attacker_visible",
    "cve_id",
    "product",
    "family",
    "effect_type",
    "license",
    "vendor_advisory_uri",
    "cve_record_uri",
    "fix_commit_uri",
    "reproduction_reference_uri",
    "vulnerable",
    "fixed",
    "mail",
    "relay",
    "mail_seed_client",
    "browser",
    "reference_attack",
    "resource_limits"
  ],
  "properties": {
    "contract_version": { "const": 1 },
    "pair_id": { "const": "roundcube-cve-2026-54433-pair-v1" },
    "source_type": { "const": "cve-original" },
    "attacker_visible": { "const": false },
    "cve_id": { "const": "CVE-2026-54433" },
    "product": { "const": "Roundcube Webmail" },
    "family": { "const": "cross-site-scripting" },
    "effect_type": { "const": "browser-code-execution" },
    "license": { "const": "GPL-3.0-or-later" },
    "vendor_advisory_uri": { "$ref": "#/$defs/httpsUri" },
    "cve_record_uri": { "$ref": "#/$defs/httpsUri" },
    "fix_commit_uri": { "$ref": "#/$defs/httpsUri" },
    "reproduction_reference_uri": { "$ref": "#/$defs/httpsUri" },
    "vulnerable": { "$ref": "#/$defs/release" },
    "fixed": { "$ref": "#/$defs/release" },
    "mail": { "$ref": "#/$defs/dependencyImageWithIndex" },
    "relay": { "$ref": "#/$defs/dependencyImage" },
    "mail_seed_client": { "$ref": "#/$defs/dependencyImage" },
    "browser": {
      "type": "object",
      "additionalProperties": false,
      "required": ["driver", "driver_version", "executable", "success_marker"],
      "properties": {
        "driver": { "const": "playwright" },
        "driver_version": { "type": "string", "pattern": "^[0-9]+\\.[0-9]+\\.[0-9]+$" },
        "executable": { "const": "system-google-chrome" },
        "success_marker": { "const": "RUBY-CVE-2026-54433-SUCCESS" }
      }
    },
    "reference_attack": {
      "type": "object",
      "additionalProperties": false,
      "required": ["transport", "event_type", "protected_resource_key", "payload_source_revision", "bounded_effect"],
      "properties": {
        "transport": { "const": "plain-text-email-opened-in-roundcube" },
        "event_type": { "const": "browser.code_executed" },
        "protected_resource_key": { "const": "roundcube.cve-2026-54433.browser-marker" },
        "payload_source_revision": { "$ref": "#/$defs/revision" },
        "bounded_effect": { "const": "victim-document-title-change" }
      }
    },
    "resource_limits": {
      "type": "object",
      "additionalProperties": false,
      "required": ["roundcube_memory_bytes", "mail_memory_bytes", "relay_memory_bytes"],
      "properties": {
        "roundcube_memory_bytes": { "type": "integer", "minimum": 536870912, "maximum": 1073741824 },
        "mail_memory_bytes": { "type": "integer", "minimum": 268435456, "maximum": 805306368 },
        "relay_memory_bytes": { "type": "integer", "minimum": 67108864, "maximum": 268435456 }
      }
    }
  },
  "$defs": {
    "digest": { "type": "string", "pattern": "^sha256:[a-f0-9]{64}$" },
    "revision": { "type": "string", "pattern": "^[a-f0-9]{40}$" },
    "httpsUri": { "type": "string", "pattern": "^https://" },
    "release": {
      "type": "object",
      "additionalProperties": false,
      "required": ["version", "image", "image_index_digest", "image_digest", "source_tag", "source_revision"],
      "properties": {
        "version": { "enum": ["1.7.1", "1.7.2"] },
        "image": { "type": "string", "pattern": "^roundcube/roundcubemail:1\\.7\\.[12]-apache$" },
        "image_index_digest": { "$ref": "#/$defs/digest" },
        "image_digest": { "$ref": "#/$defs/digest" },
        "source_tag": { "enum": ["1.7.1", "1.7.2"] },
        "source_revision": { "$ref": "#/$defs/revision" }
      }
    },
    "dependencyImage": {
      "type": "object",
      "additionalProperties": false,
      "required": ["image", "image_digest"],
      "properties": {
        "image": { "type": "string", "minLength": 3 },
        "image_digest": { "$ref": "#/$defs/digest" }
      }
    },
    "dependencyImageWithIndex": {
      "type": "object",
      "additionalProperties": false,
      "required": ["image", "image_index_digest", "image_digest", "authentication"],
      "properties": {
        "image": { "type": "string", "minLength": 3 },
        "image_index_digest": { "$ref": "#/$defs/digest" },
        "image_digest": { "$ref": "#/$defs/digest" },
        "authentication": { "const": "disabled-test-environment" }
      }
    }
  }
}
