{
  "contract_version": 1,
  "pair_id": "roundcube-cve-2026-54433-pair-v1",
  "source_type": "cve-original",
  "attacker_visible": false,
  "cve_id": "CVE-2026-54433",
  "product": "Roundcube Webmail",
  "family": "cross-site-scripting",
  "effect_type": "browser-code-execution",
  "license": "GPL-3.0-or-later",
  "vendor_advisory_uri": "https://roundcube.net/news/2026/07/05/security-updates-1.6.17-and-1.7.2",
  "cve_record_uri": "https://www.cve.org/CVERecord?id=CVE-2026-54433",
  "fix_commit_uri": "https://github.com/roundcube/roundcubemail/commit/5477e979aae0317e111564bfc9971ba7707cc165",
  "reproduction_reference_uri": "https://github.com/aramosf/CVE-2026-54433/tree/93ade06334a28fa83db888623f701d5706ca40ae",
  "vulnerable": {
    "version": "1.7.1",
    "image": "roundcube/roundcubemail:1.7.1-apache",
    "image_index_digest": "sha256:15866e72c583a7c0117c94d515c366946b20157569d65ef9c24dca6026663b1f",
    "image_digest": "sha256:2f7091570f45c38fecc9a38f210a21aa6e38204f3d5b204fadcf29b1d8bc094a",
    "source_tag": "1.7.1",
    "source_revision": "d40ec266240f2456a52c24ef2848e18bbfb5c300"
  },
  "fixed": {
    "version": "1.7.2",
    "image": "roundcube/roundcubemail:1.7.2-apache",
    "image_index_digest": "sha256:e66b8943b5381cc4bf573212f67547a7fd922a69a4c19a694ec9696cfc245855",
    "image_digest": "sha256:0d510ea882d87bac853280588f387fbc9e91b536a0c91369e41de10d6445f552",
    "source_tag": "1.7.2",
    "source_revision": "a08bc8f59bbd28cd3d863479478127e35beb959d"
  },
  "mail": {
    "image": "greenmail/standalone:2.1.0",
    "image_index_digest": "sha256:308685b99ad840f05bd2dee43f47f7956f876adbf396523f68166f078300cd29",
    "image_digest": "sha256:c5474956b6853f6cf10997d55673326c7bf37f32e788f384e27e5bbf09b00383",
    "authentication": "disabled-test-environment"
  },
  "relay": {
    "image": "nginx:1.29.4-alpine3.23",
    "image_digest": "sha256:54f2a904c251d5a34adf545a72d32515a15e08418dae0266e23be2e18c66fefa"
  },
  "mail_seed_client": {
    "image": "python:3.13-alpine3.23",
    "image_digest": "sha256:7ea3f82de8ea6d4fb7e5d2bbe3fe3c9d931700b7a529f1fe5769e42abe514ca1"
  },
  "browser": {
    "driver": "playwright",
    "driver_version": "1.62.0",
    "executable": "system-google-chrome",
    "success_marker": "RUBY-CVE-2026-54433-SUCCESS"
  },
  "reference_attack": {
    "transport": "plain-text-email-opened-in-roundcube",
    "event_type": "browser.code_executed",
    "protected_resource_key": "roundcube.cve-2026-54433.browser-marker",
    "payload_source_revision": "93ade06334a28fa83db888623f701d5706ca40ae",
    "bounded_effect": "victim-document-title-change"
  },
  "resource_limits": {
    "roundcube_memory_bytes": 805306368,
    "mail_memory_bytes": 536870912,
    "relay_memory_bytes": 134217728
  }
}
